{"$schema":"http://json-schema.org/draft-07/schema#","$id":"stegverse_context_packet.schema.json","title":"StegVerse Context Packet v1","type":"object","required":["schema","packet_id","vault_id","created_by","target_entity","allowed_use","forbidden_use","privacy_class","stop_condition"],"properties":{"schema":{"type":"string","const":"stegverse_knowledgevault_context_packet.v1"},"packet_id":{"type":"string"},"vault_id":{"type":"string"},"created_at":{"type":"string"},"created_by":{"type":"string"},"target_entity":{"type":"string"},"target_stage":{"type":"string"},"purpose":{"type":"string"},"identity_context":{"type":"string"},"allowed_use":{"type":"array","items":{"type":"string"}},"forbidden_use":{"type":"array","items":{"type":"string"}},"privacy_class":{"type":"string"},"stop_condition":{"type":"string"},"included_files":{"type":"array","items":{"type":"string"}},"packet_hash":{"type":"string"}}}
